{
  "$schema": "https://json-schema.org/draft/2020-12/schema",
  "$id": "https://github.com/marcmalerei/gluon/blob/main/release/release-contract.schema.json",
  "title": "Gluon release contract",
  "type": "object",
  "additionalProperties": false,
  "required": [
    "schemaVersion",
    "releaseGroup",
    "targetVersion",
    "tagPrefix",
    "environment",
    "artifactDirectory",
    "typeVerificationDependencies",
    "releaseCutEvidencePath",
    "compatibilityManifestPath",
    "bootstrap",
    "npmOwnerRecovery",
    "githubReleaseEnvironment",
    "githubReleaseTagProtection",
    "supportBoundary",
    "spdxSchema",
    "artifacts",
    "publication",
    "externalPrerequisites"
  ],
  "properties": {
    "$schema": { "type": "string" },
    "schemaVersion": { "const": 1 },
    "releaseGroup": { "const": "gluon-framework" },
    "targetVersion": { "type": "string", "pattern": "^[1-9][0-9]*\\.[0-9]+\\.[0-9]+$" },
    "tagPrefix": { "const": "v" },
    "environment": { "const": "npm" },
    "artifactDirectory": { "const": ".tmp/release" },
    "typeVerificationDependencies": {
      "type": "object",
      "additionalProperties": false,
      "required": ["@storybook/react"],
      "properties": {
        "@storybook/react": { "const": "10.5.3" }
      }
    },
    "releaseCutEvidencePath": { "const": "release/evidence/{version}.json" },
    "compatibilityManifestPath": { "const": "release/compatibility/{version}.json" },
    "bootstrap": {
      "type": "object",
      "additionalProperties": false,
      "required": ["version", "baselineVersion", "artifactDirectory", "distTag", "access", "identity", "latestPolicy", "supersededRecords", "packageFiles"],
      "properties": {
        "version": { "const": "0.0.0-bootstrap.1" },
        "baselineVersion": { "type": "string", "pattern": "^[1-9][0-9]*\\.[0-9]+\\.[0-9]+$" },
        "artifactDirectory": { "const": ".tmp/npm-bootstrap" },
        "distTag": { "const": "gluon-bootstrap" },
        "access": { "const": "public" },
        "identity": { "const": "owner-interactive-2fa" },
        "latestPolicy": { "const": "absent-or-reviewed-bootstrap-until-first-supported-release" },
        "supersededRecords": {
          "type": "array",
          "prefixItems": [
            {
              "type": "object",
              "additionalProperties": false,
              "required": ["name", "version", "integrity", "shasum"],
              "properties": {
                "name": { "const": "@gluonjs/reactivity" },
                "version": { "const": "0.0.0-bootstrap.0" },
                "integrity": { "const": "sha512-/WfS45xyarkObJanK4IbQsyznDR60Fte+mvik1mh2SUm29D/ns1tqrQs2b21FYdjAQFyq62z0WDENNBDJ4472w==" },
                "shasum": { "const": "9a1ca1af75878ea5aebba3ac6139ac0beee3273b" }
              }
            }
          ],
          "items": false
        },
        "packageFiles": {
          "type": "array",
          "prefixItems": [
            { "const": "package.json" },
            { "const": "README.md" },
            { "const": "LICENSE" }
          ],
          "items": false
        }
      }
    },
    "npmOwnerRecovery": {
      "type": "object",
      "additionalProperties": false,
      "required": [
        "model",
        "owner",
        "secondOwnerRequired",
        "mfaMode",
        "linkedGitHubAccountRequired",
        "recoveryCodesRequired",
        "recoveryCodeStorage",
        "npmSupportRecoveryRiskAccepted"
      ],
      "properties": {
        "model": { "const": "single-owner" },
        "owner": { "const": "marcmalerei" },
        "secondOwnerRequired": { "const": false },
        "mfaMode": { "const": "auth-and-writes" },
        "linkedGitHubAccountRequired": { "const": true },
        "recoveryCodesRequired": { "const": true },
        "recoveryCodeStorage": { "const": "outside-second-factor-device" },
        "npmSupportRecoveryRiskAccepted": { "const": true }
      }
    },
    "githubReleaseEnvironment": {
      "type": "object",
      "additionalProperties": false,
      "required": [
        "name",
        "approvalModel",
        "requiredReviewers",
        "independentHumanApprovalRequired",
        "selfReviewPreventionRequired",
        "waitTimerMinutes",
        "administratorBypassAllowed",
        "deploymentBranchPatterns",
        "deploymentTagPatterns",
        "longLivedNpmSecretsAllowed",
        "singleOperatorPartialLatestRiskAccepted"
      ],
      "properties": {
        "name": { "const": "npm" },
        "approvalModel": { "const": "single-operator" },
        "requiredReviewers": { "const": 0 },
        "independentHumanApprovalRequired": { "const": false },
        "selfReviewPreventionRequired": { "const": false },
        "waitTimerMinutes": { "const": 0 },
        "administratorBypassAllowed": { "const": false },
        "deploymentBranchPatterns": {
          "type": "array",
          "maxItems": 0
        },
        "deploymentTagPatterns": {
          "type": "array",
          "prefixItems": [{ "const": "v*" }],
          "items": false
        },
        "longLivedNpmSecretsAllowed": { "const": false },
        "singleOperatorPartialLatestRiskAccepted": { "const": true }
      }
    },
    "githubReleaseTagProtection": {
      "type": "object",
      "additionalProperties": false,
      "required": [
        "model",
        "operator",
        "includePatterns",
        "creationBypassActorType",
        "creationBypassMode",
        "updateBypassAllowed",
        "deletionBypassAllowed"
      ],
      "properties": {
        "model": { "const": "operator-created-immutable-tags" },
        "operator": { "const": "marcmalerei" },
        "includePatterns": {
          "type": "array",
          "minItems": 1,
          "prefixItems": [{ "const": "refs/tags/v*" }],
          "items": false
        },
        "creationBypassActorType": { "const": "User" },
        "creationBypassMode": { "const": "always" },
        "updateBypassAllowed": { "const": false },
        "deletionBypassAllowed": { "const": false }
      }
    },
    "supportBoundary": {
      "type": "object",
      "additionalProperties": false,
      "required": [
        "model",
        "brandedBrowserSupportClaimed",
        "operatingSystemSupportClaimed",
        "deviceSupportClaimed",
        "assistiveTechnologySupportClaimed",
        "manualBrowserDeviceEvidenceRequired",
        "manualAssistiveTechnologyEvidenceRequired",
        "singleOperatorRiskAccepted"
      ],
      "properties": {
        "model": { "const": "automated-engine-evidence-only" },
        "brandedBrowserSupportClaimed": { "const": false },
        "operatingSystemSupportClaimed": { "const": false },
        "deviceSupportClaimed": { "const": false },
        "assistiveTechnologySupportClaimed": { "const": false },
        "manualBrowserDeviceEvidenceRequired": { "const": false },
        "manualAssistiveTechnologyEvidenceRequired": { "const": false },
        "singleOperatorRiskAccepted": { "const": true }
      }
    },
    "spdxSchema": {
      "type": "object",
      "additionalProperties": false,
      "required": ["path", "source", "sourceCommit", "sha256"],
      "properties": {
        "path": { "const": "release/spdx-2.3.schema.json" },
        "source": { "type": "string", "format": "uri", "pattern": "^https://raw\\.githubusercontent\\.com/spdx/spdx-spec/[a-f0-9]{40}/schemas/spdx-schema\\.json$" },
        "sourceCommit": { "type": "string", "pattern": "^[a-f0-9]{40}$" },
        "sha256": { "type": "string", "pattern": "^[a-f0-9]{64}$" }
      }
    },
    "artifacts": {
      "type": "object",
      "additionalProperties": false,
      "required": [
        "packageArchives",
        "canonicalPackageDigests",
        "aggregateSbomFormats",
        "perPackageSbomFormats",
        "checksums",
        "releaseEvidence"
      ],
      "properties": {
        "packageArchives": { "const": true },
        "canonicalPackageDigests": { "const": true },
        "aggregateSbomFormats": {
          "type": "array",
          "prefixItems": [{ "const": "spdx-2.3" }, { "const": "cyclonedx-1.7" }],
          "items": false
        },
        "perPackageSbomFormats": {
          "type": "array",
          "prefixItems": [{ "const": "spdx-2.3" }, { "const": "cyclonedx-1.7" }],
          "items": false
        },
        "checksums": { "const": "sha256" },
        "releaseEvidence": { "const": true }
      }
    },
    "publication": {
      "type": "object",
      "additionalProperties": false,
      "required": ["registry", "access", "provenance", "distTag", "promotion", "identity", "longLivedTokenAllowed"],
      "properties": {
        "registry": { "const": "https://registry.npmjs.org" },
        "access": { "const": "public" },
        "provenance": { "const": true },
        "distTag": { "const": "latest" },
        "promotion": { "const": "direct-trusted-publishing" },
        "identity": { "const": "npm-trusted-publishing" },
        "longLivedTokenAllowed": { "const": false }
      }
    },
    "externalPrerequisites": {
      "type": "array",
      "minItems": 8,
      "uniqueItems": true,
      "items": { "type": "string", "minLength": 1 }
    }
  }
}
