{
  "$schema": "./release-contract.schema.json",
  "schemaVersion": 1,
  "releaseGroup": "gluon-framework",
  "targetVersion": "1.14.0",
  "tagPrefix": "v",
  "environment": "npm",
  "artifactDirectory": ".tmp/release",
  "typeVerificationDependencies": {
    "@storybook/react": "10.5.3"
  },
  "releaseCutEvidencePath": "release/evidence/{version}.json",
  "compatibilityManifestPath": "release/compatibility/{version}.json",
  "bootstrap": {
    "version": "0.0.0-bootstrap.1",
    "baselineVersion": "1.12.3",
    "artifactDirectory": ".tmp/npm-bootstrap",
    "distTag": "gluon-bootstrap",
    "access": "public",
    "identity": "owner-interactive-2fa",
    "latestPolicy": "absent-or-reviewed-bootstrap-until-first-supported-release",
    "supersededRecords": [
      {
        "name": "@gluonjs/reactivity",
        "version": "0.0.0-bootstrap.0",
        "integrity": "sha512-/WfS45xyarkObJanK4IbQsyznDR60Fte+mvik1mh2SUm29D/ns1tqrQs2b21FYdjAQFyq62z0WDENNBDJ4472w==",
        "shasum": "9a1ca1af75878ea5aebba3ac6139ac0beee3273b"
      }
    ],
    "packageFiles": [
      "package.json",
      "README.md",
      "LICENSE"
    ]
  },
  "npmOwnerRecovery": {
    "model": "single-owner",
    "owner": "marcmalerei",
    "secondOwnerRequired": false,
    "mfaMode": "auth-and-writes",
    "linkedGitHubAccountRequired": true,
    "recoveryCodesRequired": true,
    "recoveryCodeStorage": "outside-second-factor-device",
    "npmSupportRecoveryRiskAccepted": true
  },
  "githubReleaseEnvironment": {
    "name": "npm",
    "approvalModel": "single-operator",
    "requiredReviewers": 0,
    "independentHumanApprovalRequired": false,
    "selfReviewPreventionRequired": false,
    "waitTimerMinutes": 0,
    "administratorBypassAllowed": false,
    "deploymentBranchPatterns": [],
    "deploymentTagPatterns": [
      "v*"
    ],
    "longLivedNpmSecretsAllowed": false,
    "singleOperatorPartialLatestRiskAccepted": true
  },
  "githubReleaseTagProtection": {
    "model": "operator-created-immutable-tags",
    "operator": "marcmalerei",
    "includePatterns": [
      "refs/tags/v*"
    ],
    "creationBypassActorType": "User",
    "creationBypassMode": "always",
    "updateBypassAllowed": false,
    "deletionBypassAllowed": false
  },
  "supportBoundary": {
    "model": "automated-engine-evidence-only",
    "brandedBrowserSupportClaimed": false,
    "operatingSystemSupportClaimed": false,
    "deviceSupportClaimed": false,
    "assistiveTechnologySupportClaimed": false,
    "manualBrowserDeviceEvidenceRequired": false,
    "manualAssistiveTechnologyEvidenceRequired": false,
    "singleOperatorRiskAccepted": true
  },
  "spdxSchema": {
    "path": "release/spdx-2.3.schema.json",
    "source": "https://raw.githubusercontent.com/spdx/spdx-spec/44ab76293754df4af5af700fd4abd5453b866c86/schemas/spdx-schema.json",
    "sourceCommit": "44ab76293754df4af5af700fd4abd5453b866c86",
    "sha256": "ca7fd7cc2c8107c3b6b5976058bb72363e8c072f0e446609d4fe7234860c2894"
  },
  "artifacts": {
    "packageArchives": true,
    "canonicalPackageDigests": true,
    "aggregateSbomFormats": [
      "spdx-2.3",
      "cyclonedx-1.7"
    ],
    "perPackageSbomFormats": [
      "spdx-2.3",
      "cyclonedx-1.7"
    ],
    "checksums": "sha256",
    "releaseEvidence": true
  },
  "publication": {
    "registry": "https://registry.npmjs.org",
    "access": "public",
    "provenance": true,
    "distTag": "latest",
    "promotion": "direct-trusted-publishing",
    "identity": "npm-trusted-publishing",
    "longLivedTokenAllowed": false
  },
  "externalPrerequisites": [
    "public-repository",
    "verified-npm-scope-control",
    "existing-npm-package-records",
    "npm-single-owner-recovery-and-mfa",
    "verified-npm-trusted-publisher",
    "verified-single-operator-npm-environment",
    "protected-release-tags",
    "immutable-github-releases"
  ]
}
